{
  "$schema": "https://fluidsbench.org/schemas/scoring-support/v1/case-index.schema.json",
  "schema_version": "1.0",
  "release_id": "windsorml-native-support-v1-candidate",
  "dataset_id": "windsorml",
  "case_set_id": "geometry-test",
  "case_count": 71,
  "chunks": [
    {
      "file": "chunk-000.json",
      "sha256": "31ce97d0e38fae22541408bc0561a180d3d94843db361f4785e0d8618b62a02d",
      "case_count": 25,
      "case_ids": [
        "run_5",
        "run_10",
        "run_11",
        "run_14",
        "run_17",
        "run_20",
        "run_40",
        "run_47",
        "run_50",
        "run_57",
        "run_59",
        "run_60",
        "run_66",
        "run_72",
        "run_79",
        "run_81",
        "run_94",
        "run_97",
        "run_107",
        "run_110",
        "run_111",
        "run_117",
        "run_121",
        "run_123",
        "run_130"
      ]
    },
    {
      "file": "chunk-001.json",
      "sha256": "a904cc18fd6bc97ba8f3d63d5f17c0035e1390cf2d8bd1fa55a1886495388792",
      "case_count": 25,
      "case_ids": [
        "run_132",
        "run_139",
        "run_140",
        "run_143",
        "run_148",
        "run_149",
        "run_152",
        "run_154",
        "run_160",
        "run_161",
        "run_167",
        "run_169",
        "run_178",
        "run_182",
        "run_190",
        "run_202",
        "run_211",
        "run_221",
        "run_224",
        "run_228",
        "run_229",
        "run_236",
        "run_238",
        "run_239",
        "run_240"
      ]
    },
    {
      "file": "chunk-002.json",
      "sha256": "d4c5eb922c6bd69d1687615ed014a500a3ae49e96a33e89cf34e11047bdc5a7f",
      "case_count": 21,
      "case_ids": [
        "run_244",
        "run_246",
        "run_248",
        "run_252",
        "run_254",
        "run_264",
        "run_268",
        "run_287",
        "run_288",
        "run_295",
        "run_298",
        "run_299",
        "run_310",
        "run_311",
        "run_318",
        "run_330",
        "run_331",
        "run_335",
        "run_337",
        "run_339",
        "run_349"
      ]
    }
  ]
}
