{
  "$schema": "https://fluidsbench.org/schemas/scoring-support/v1/case-index.schema.json",
  "schema_version": "1.0",
  "release_id": "windsorml-native-support-v1",
  "dataset_id": "windsorml",
  "case_set_id": "baseline-test",
  "case_count": 35,
  "chunks": [
    {
      "file": "chunk-000.json",
      "sha256": "2f9d4855afc707f8870f7fad05426b28405e09938fd39ad904aac37b92b9938e",
      "case_count": 25,
      "case_ids": [
        "run_7",
        "run_18",
        "run_23",
        "run_28",
        "run_32",
        "run_47",
        "run_58",
        "run_66",
        "run_69",
        "run_85",
        "run_89",
        "run_95",
        "run_97",
        "run_98",
        "run_100",
        "run_104",
        "run_113",
        "run_123",
        "run_125",
        "run_130",
        "run_136",
        "run_139",
        "run_148",
        "run_172",
        "run_216"
      ]
    },
    {
      "file": "chunk-001.json",
      "sha256": "30e757fc124e365c479c73400e230151d16beeff65aa9bb67754bbb2ce2286ea",
      "case_count": 10,
      "case_ids": [
        "run_232",
        "run_253",
        "run_256",
        "run_257",
        "run_270",
        "run_283",
        "run_299",
        "run_333",
        "run_336",
        "run_341"
      ]
    }
  ]
}
